<?xml version="1.0" ?>

<!DOCTYPE movies SYSTEM "../DTD/movie.dtd">

<movies>
	<movie>
		<name>Transformers</name>
		<resume>Decepticons vs Optimus Prime</resume>
		<year>2007</year>
		<director>Michael Bay</director>
		<picture>http://ia.media-imdb.com/images/M/MV5BMTQwNjU5MzUzNl5BMl5BanBnXkFtZTYwMzc1MTI3._V1_SY317_CR0,0,214,317_.jpg</picture>
		<genre>Action</genre>
		<minimumAge>12</minimumAge>
	</movie>
</movies>